{
  "$schema": "https://json-schema.org/draft/2020-12/schema",
  "type": "object",
  "required": [
    "design",
    "spec",
    "implement",
    "checks",
    "lenses"
  ],
  "properties": {
    "$schema": {
      "type": "string"
    },
    "repo": {
      "type": "string",
      "pattern": "^[\\w.-]+/[\\w.-]+$",
      "description": "\"owner/name\" on GitHub"
    },
    "worktreeRoot": {
      "type": "string",
      "minLength": 1,
      "description": "Where issue worktrees go: absolute, ~/..., or relative to the repo root (default ../<repo>-worktrees)."
    },
    "parent": {
      "type": "integer",
      "minimum": 1,
      "description": "Tracking issue; follow-up issues become its sub-issues."
    },
    "defaultLenses": {
      "type": "array",
      "items": {
        "type": "string",
        "pattern": "^[a-z][a-z0-9-]{0,31}$"
      },
      "minItems": 1,
      "description": "Lenses every run gets; must include \"code\" (default [\"code\"])."
    },
    "design": {
      "type": "string",
      "minLength": 1,
      "maxLength": 4000,
      "description": "Where the project's design lives and how to treat it, for every stage. E.g. 'The design record is README.md plus the ADRs in docs/adr/; a change that contradicts an ADR must say so in its spec.'"
    },
    "seamNote": {
      "type": "string",
      "minLength": 1,
      "maxLength": 500,
      "description": "What later issues build on, for the `seam` label's reviewer note. E.g. 'the export query, the page templates'."
    },
    "specDir": {
      "type": "string",
      "pattern": "^[\\w.-]+(/[\\w.-]+)*$",
      "description": "Where specs are written (default docs/specs)."
    },
    "spec": {
      "type": "object",
      "required": [
        "design"
      ],
      "properties": {
        "design": {
          "type": "string",
          "minLength": 1,
          "maxLength": 4000,
          "description": "What the spec's Design section must pin down for this project (files, interfaces, schemas, routes, fixtures...)."
        }
      },
      "additionalProperties": false
    },
    "implement": {
      "type": "string",
      "minLength": 1,
      "maxLength": 4000,
      "description": "Project rules for the implement stage: fixtures, data that tests must never read, how to run things."
    },
    "checks": {
      "type": "array",
      "items": {
        "type": "object",
        "required": [
          "name",
          "command"
        ],
        "properties": {
          "name": {
            "type": "string",
            "pattern": "^[a-z][a-z0-9-]{0,31}$"
          },
          "command": {
            "type": "string",
            "minLength": 1,
            "maxLength": 500,
            "description": "Shell command, run from the worktree root."
          }
        },
        "additionalProperties": false
      },
      "minItems": 1,
      "maxItems": 8,
      "description": "Commands every writing stage runs and reports, by name."
    },
    "lenses": {
      "type": "object",
      "patternProperties": {
        "^[a-z][a-z0-9-]{0,31}$": {
          "type": "string",
          "minLength": 1,
          "maxLength": 3000,
          "description": "What this reviewer checks."
        }
      },
      "additionalProperties": false,
      "minProperties": 1,
      "maxProperties": 8,
      "description": "Review lenses by name. `code` must be defined; label `review:<name>` adds a lens to a run."
    },
    "skills": {
      "type": "object",
      "properties": {
        "build": {
          "type": "string",
          "minLength": 1,
          "description": "Skill(s) for implement and revise (comma-separated)."
        },
        "lenses": {
          "type": "object",
          "patternProperties": {
            "^[a-z][a-z0-9-]{0,31}$": {
              "type": "string",
              "minLength": 1
            }
          },
          "additionalProperties": false
        }
      },
      "additionalProperties": false
    },
    "commitAuthor": {
      "type": "object",
      "required": [
        "name",
        "email"
      ],
      "properties": {
        "name": {
          "type": "string",
          "pattern": "^[^\\x00-\\x1f\\x7f`$\\\\]+$",
          "description": "No control characters, backticks, $ or backslashes."
        },
        "email": {
          "type": "string",
          "pattern": "^[A-Za-z0-9._%+-]+@[A-Za-z0-9.-]+$"
        }
      },
      "additionalProperties": false,
      "description": "Commit identity for the stages (default: the worktree's git config)."
    },
    "models": {
      "type": "object",
      "properties": {
        "strong": {
          "type": "string",
          "minLength": 1,
          "description": "Spec and review (default claude-bridge/claude-opus-5-5)."
        },
        "fast": {
          "type": "string",
          "minLength": 1,
          "description": "Implement, revise, PR (default claude-bridge/claude-sonnet-5-5)."
        },
        "small": {
          "type": "string",
          "minLength": 1,
          "description": "Flagging a human (default claude-bridge/claude-haiku-5-5)."
        }
      },
      "additionalProperties": false
    }
  },
  "additionalProperties": false,
  "title": "pi-factory configuration (.pi/factory.json)",
  "description": "See https://github.com/seandavi/pi-factory/blob/main/docs/factory.md"
}
